{
  "schema_version": "1.0.0",
  "artifact_id": "market-example-2026-09-12",
  "artifact_type": "market_review",
  "title": "Synthetic A-share market review",
  "as_of": "2026-09-12T15:00:00+08:00",
  "generated_at": "2026-09-12T08:00:00Z",
  "subject": { "kind": "market", "name": "A-share synthetic fixture", "identifiers": {}, "market": "CN", "period": "full_session" },
  "request": { "user_goal": "Validate the market contract", "requested_outputs": ["ppt", "article"], "constraints": ["synthetic fixture"] },
  "facts": [{ "fact_id": "F1", "statement": "Synthetic index change", "value": 0.5, "unit": "%", "timestamp": "2026-09-12T15:00:00+08:00", "status": "verified", "source_ids": ["S1"] }],
  "timeline": [],
  "drivers": [],
  "conclusions": [{ "conclusion_id": "C1", "statement": "Synthetic market conclusion", "type": "primary", "fact_ids": ["F1"], "driver_ids": [], "source_ids": ["S1"], "confidence": 0.8 }],
  "risks": [],
  "watchpoints": [],
  "sources": [{ "source_id": "S1", "title": "Synthetic market fixture", "source_type": "synthetic", "provider": null, "url": null }],
  "quality": { "date_verified": true, "fiscal_period_verified": null, "consensus_verified": null, "intraday_granularity": "daily_close", "unresolved_conflicts": [], "warnings": [] },
  "provenance": { "orchestration_mode": "direct_research_os", "orchestrator": null, "project_owners": ["daily-review"], "capabilities_used": ["a_share_market_review"], "skills_used": ["market-daily-review"], "tools_used": [], "knowledge_refs": [] }
}
